{
  "evaluated_at": "2026-10-03T03:00:37Z",
  "execution_mode": "live",
  "faults": [],
  "health_workflow": {
    "revision": "446016d15d6c16b599bdaf89a97bc450b71205f4",
    "run_attempt": 1,
    "run_id": "37091734027"
  },
  "policy_sha256": "d7561128c1ea0f04de361dae5bacdd9778ce483d606d4e9423743f6c625ea390",
  "receipt_sha256": "1959ffa2b9ed640c3e482dc629b4365e00e6d7129851d77e886d44ca0a628815",
  "repository": "StatPan/datapan-registry",
  "schema_version": "datapan.upstream-catalogue-health.v1",
  "source_policy_sha256": "61dfb817f743085918c9f613fcd4a2dcf0d2f3de9df31b005cae1cd0250d5cfc",
  "sources": [
    {
      "canonical": {
        "last_good": null,
        "main": {
          "manifest_sha256": "b5b40b3f28ea11d4748b906ace1b2c9936320f4bb322557d868206f409940fbf",
          "registry_bytes": 137735169,
          "registry_path": "data/data-go-kr.registry.json",
          "registry_sha256": "eeda72ee8590f458de8d75703662578e80edf3e61282f0e5e67547c4f6e5f644",
          "revision": "446016d15d6c16b599bdaf89a97bc450b71205f4"
        },
        "promotion_stage": null,
        "promotion_status": "unavailable",
        "publication": null
      },
      "collector": {
        "age_seconds": 270985,
        "expected_interval_seconds": 604800,
        "grace_seconds": 86400,
        "latest_execution_run": {
          "artifacts": [
            {
              "artifact_id": "11068634862",
              "expired": false,
              "expires_at": "2026-10-29T23:47:49Z",
              "name": "upstream-catalog-refresh-36646768289"
            }
          ],
          "conclusion": "success",
          "created_at": "2026-09-29T23:44:12Z",
          "event": "schedule",
          "head_branch": "main",
          "head_sha": "4321df1868754045ff3705b5c133c9fad2abde6e",
          "run_id": "36646768289",
          "status": "completed",
          "updated_at": "2026-09-29T23:47:58Z"
        },
        "latest_scheduled_run": {
          "artifacts": [
            {
              "artifact_id": "11068634862",
              "expired": false,
              "expires_at": "2026-10-29T23:47:49Z",
              "name": "upstream-catalog-refresh-36646768289"
            }
          ],
          "conclusion": "success",
          "created_at": "2026-09-29T23:44:12Z",
          "event": "schedule",
          "head_branch": "main",
          "head_sha": "4321df1868754045ff3705b5c133c9fad2abde6e",
          "run_id": "36646768289",
          "status": "completed",
          "updated_at": "2026-09-29T23:47:58Z"
        }
      },
      "faults": [],
      "observation": {
        "age_seconds": 270958,
        "collection_status": "success",
        "execution_mode": "live",
        "max_age_seconds": 691200,
        "observed_at": "2026-09-29T23:44:39Z",
        "producer_run_id": "36646768289",
        "refresh_evidence_sha256": "5b940ae0ffc71826a7aefe2de3a1453d6c28c67de9cd506c06be073d936e6197",
        "state": "fresh"
      },
      "overall": "healthy",
      "processor": {
        "attempts_by_id": {
          "15003164": 1,
          "15005257": 1,
          "15006273": 1,
          "15007088": 1,
          "15008409": 1,
          "15008517": 1,
          "15013677": 1,
          "15013679": 1,
          "15014832": 1,
          "15015158": 1,
          "15015163": 1,
          "15015164": 1,
          "15015212": 1,
          "15019347": 1,
          "15019666": 1,
          "15020786": 1,
          "15020843": 1,
          "15020966": 1,
          "15021305": 1,
          "15024888": 1,
          "15027423": 1,
          "15027426": 1,
          "15028101": 1,
          "15029122": 1
        },
        "attempts_consumed": 24,
        "candidate_sha256": "90bc22e0ad61dd3672b09b7c52e4898be5afb535f87a8d7fa9e5e5c983e6e3b5",
        "checkpoint_observed_at": "2026-09-29T23:44:39Z",
        "detail_queue_cursor": 24,
        "detail_records": [],
        "generation_id": "48bd59cf7d2da0fc75fb6e9eb6dcee205be066bbfefa5d7f88cebdee3ddd5b50",
        "last_heartbeat_at": "2026-10-03T02:58:33Z",
        "last_observation": {
          "collection_status": "success",
          "execution_mode": "live",
          "observed_at": "2026-09-29T23:44:39Z",
          "producer_run_id": "36646768289",
          "refresh_evidence_sha256": "5b940ae0ffc71826a7aefe2de3a1453d6c28c67de9cd506c06be073d936e6197"
        },
        "last_progress_at": "2026-10-03T02:58:33Z",
        "lease": {
          "expires_at": "2026-10-03T03:43:30Z",
          "fencing_token": 1,
          "owner_run_id": "37091592758-1"
        },
        "outcome": {
          "pending_count": 884,
          "reason": "request_budget_reserved",
          "reserved_attempts": 24,
          "reserved_records": 24
        },
        "output_artifact": {
          "artifact_id": null,
          "bundle_manifest_sha256": null,
          "expires_at": "2026-11-02T02:58:30Z",
          "name": "upstream-catalogue-processing-37091592758-1",
          "repository": "StatPan/datapan-registry",
          "run_id": "37091592758"
        },
        "output_digests": [],
        "request_reservation": {
          "attempt_budget": 24,
          "attempts_made": 0,
          "expires_at": "2026-10-03T03:43:30Z",
          "fencing_token": 1,
          "generation_id": "48bd59cf7d2da0fc75fb6e9eb6dcee205be066bbfefa5d7f88cebdee3ddd5b50",
          "owner_run_id": "37091592758-1",
          "records": [
            {
              "attempts_reserved": 1,
              "guide_sha256": null,
              "id": "15003164",
              "source_sha256": "dda2735ede849da6259256b9c39907b61c607bdda2dfb4932ea45db7c6695e17"
            },
            {
              "attempts_reserved": 1,
              "guide_sha256": null,
              "id": "15005257",
              "source_sha256": "d14f15e8edfddff36ff1f37148a8b1ae96550a60f0ac358cc6f3610facd20857"
            },
            {
              "attempts_reserved": 1,
              "guide_sha256": "8c8dac95aa0a16cdc1d9219faf6edef368449abe8bc11404601ca000013efe9d",
              "id": "15006273",
              "source_sha256": "a5596d2e5ae19fdc01e82119b8d832499d3862ddfc8d4d600f405d8d3f32bdc2"
            },
            {
              "attempts_reserved": 1,
              "guide_sha256": null,
              "id": "15007088",
              "source_sha256": "1ff8d011547141eb89d63ccccbc3a9232975f684af224e675ebf221ffec4bfe4"
            },
            {
              "attempts_reserved": 1,
              "guide_sha256": "cde50fd543851f7f2637be782a50bcf894491ad7d1ac31693f17091fe2c07cf5",
              "id": "15008409",
              "source_sha256": "01a8c9b91be794eb623e37182f45305434c849d236d3beebeaaa1f5c0ca560f1"
            },
            {
              "attempts_reserved": 1,
              "guide_sha256": "05cc811906e98e183ed7d585521ecafb5aeffb0630c3fcd1c17ed8fa3d0a9426",
              "id": "15008517",
              "source_sha256": "ce9e41d205b7879a8796465fc8f927e5be200fe9c471629079a67b6e00a56845"
            },
            {
              "attempts_reserved": 1,
              "guide_sha256": "0eb153d73e578046ffc18f247537446f9f127e8809cfacf9dea16079acc4ae74",
              "id": "15013677",
              "source_sha256": "0b4018e1647092479d64a424e79b4fdf2d195b33883dabdd1fe20bdc62c0458f"
            },
            {
              "attempts_reserved": 1,
              "guide_sha256": "2681b88d5955ae584d444fe96adb299eb18bcd93ee9609afd0410ad568ce6c45",
              "id": "15013679",
              "source_sha256": "4e47efa1a296e18655e4d8b484cac69f0b34fcbdd831d073487153eff5b99427"
            },
            {
              "attempts_reserved": 1,
              "guide_sha256": null,
              "id": "15014832",
              "source_sha256": "3db58f5d2918c9f79ff62f4236174af4879562a8598a8483058d3fb265fa25f9"
            },
            {
              "attempts_reserved": 1,
              "guide_sha256": null,
              "id": "15015158",
              "source_sha256": "48992bec4b0143b6c7eac5b46a881f2eb169f2e1a78a9cc6547434819cd1c4ad"
            },
            {
              "attempts_reserved": 1,
              "guide_sha256": null,
              "id": "15015163",
              "source_sha256": "9fbf9e734b87e04d7de1cde8e26edbcfe54efae6c303cef712726111dffb3ec4"
            },
            {
              "attempts_reserved": 1,
              "guide_sha256": null,
              "id": "15015164",
              "source_sha256": "919a56365dab62a299c732dff4d10ba24a3df8e47b8ac2175b969af8de69a892"
            },
            {
              "attempts_reserved": 1,
              "guide_sha256": "2130d5d02e2b2547af327c03d65b4ab3209b363e22578622e10e506b503b8846",
              "id": "15015212",
              "source_sha256": "aeab05fe99434ed3ad94ff972deec995641c6f63b2c6514dadc63ad1fde86dc9"
            },
            {
              "attempts_reserved": 1,
              "guide_sha256": "17e7acf06344c102209755c3e440bb7ead6d89a0b4ae679643365d829825e06f",
              "id": "15019347",
              "source_sha256": "2fe54dfb551dfdd11ccd0d647c2f7dfa9238340b396b44e29c139dead3e2652d"
            },
            {
              "attempts_reserved": 1,
              "guide_sha256": "30984ff4368c98ac0c23d34de50083924de339f64a4d31dc96308852d43282f9",
              "id": "15019666",
              "source_sha256": "80987dfec69c58d7eae8df15a36c4622c617a8116379d4e7f46855a186a3b9d5"
            },
            {
              "attempts_reserved": 1,
              "guide_sha256": "fab8147ca66d08d3d19226fefd95ab51ab9503871fea6757c836a69be8b33764",
              "id": "15020786",
              "source_sha256": "5e982c0441738a5711cac44e0b6b71788d5a64c8625a0a5a229751b17fe463b1"
            },
            {
              "attempts_reserved": 1,
              "guide_sha256": null,
              "id": "15020843",
              "source_sha256": "deca26a5c57d7f84546401c9ee6c24121bd59da762ff851487061e37602994c6"
            },
            {
              "attempts_reserved": 1,